{
    "$schema": "https://json-schema.org/draft/2020-12/schema",
    "beaconHandovers": [
        {
            "handoverType": {
                "id": "EFO:0004157",
                "label": "BAM format"
            },
            "note": "This handover link provides access to a summarized VCF.",
            "url": "https://api.mygenomeservice.org/Handover/9dcc48d7-fc88-11e8-9110-b0c592dbf8c0"
        },
        {
            "handoverType": {
                "id": "EFO:0004157",
                "label": "BAM format"
            },
            "note": "This handover link provides access to a summarized VCF.",
            "url": "https://api.mygenomeservice.org/Handover/9dcc48d7-fc88-11e8-9110-b0c592dbf8c0"
        }
    ],
    "info": {
        "someInterestingStuff": "this is the interesting stuff"
    },
    "meta": {
        "apiVersion": "v2.0",
        "beaconId": "org.example.beacon.v2",
        "receivedRequestSummary": {
            "apiVersion": "2.0",
            "pagination": {
                "limit": 10,
                "skip": 0
            },
            "requestedSchemas": [
                {
                    "entryType": "EntryTypeB",
                    "schema": "entry-typeB-schema-v1.0"
                }
            ]
        },
        "returnedSchemas": [
            {
                "entryType": "EntryTypeB",
                "schema": "entry-typeB-schema-v1.0"
            }
        ]
    },
    "responseSummary": {
        "exists": true,
        "numTotalResults": 25355
    }
}